Company,Role,Match_Score,Location,Job_Type,HR_Name,HR_Email,Recruiter_Name,Recruiter_Linkedin,Company_Website,Company_Size,Tech_Stack,Job_Description,Why_Match,Suggested_Subject,Application_Link
Stripe,Backend Engineer,95,Remote,Full-time,Sarah Chen,sarah.chen@stripe.com,,,https://stripe.com,3000-5000,"Java, Go, Kubernetes, Kafka","Build and scale Stripe's core payment infrastructure. Work on distributed systems handling millions of transactions per second.","Strong Java background, experience with distributed systems and Kafka","Your Java + Kafka experience for Stripe's Backend Engineer role",https://stripe.com/jobs/backend-eng
Notion,Full Stack Engineer,88,San Francisco,Full-time,James Park,james@makenotion.com,,,https://notion.so,500-1000,"TypeScript, React, Node.js, PostgreSQL","Build features used by millions of knowledge workers. Own entire features end-to-end.","TypeScript and React expertise, full-stack project experience","Full Stack Engineer at Notion — TypeScript & React fit",https://notion.so/careers/fullstack
Vercel,Platform Engineer,82,Remote,Full-time,Maria Gomez,maria@vercel.com,,,https://vercel.com,200-500,"Next.js, Node.js, AWS, Docker, Kubernetes","Work on the Vercel platform infrastructure. Improve build pipelines and edge network.","Next.js expertise and Docker/Kubernetes knowledge","Platform Engineer at Vercel — Next.js + Infrastructure background",https://vercel.com/careers
Linear,Software Engineer,90,Remote,Full-time,Alex Kim,alex@linear.app,,,https://linear.app,50-200,"TypeScript, React, GraphQL, PostgreSQL","Build the fastest issue tracker for high-performance teams. Small team, high impact.","TypeScript full-stack experience, passion for developer tools","Software Engineer — TypeScript + GraphQL experience for Linear",https://linear.app/careers
PlanetScale,Backend Engineer,85,Remote,Full-time,Chris Lee,chris@planetscale.com,,,https://planetscale.com,100-200,"Go, MySQL, Kubernetes, Vitess","Scale MySQL to the cloud. Work on database infrastructure used by companies like GitHub.","MySQL and distributed systems knowledge, infrastructure interest","Backend Engineer at PlanetScale — MySQL & Go experience",https://planetscale.com/careers
